[
  {
    "rule_id": "rule_classify_noun_vs_verb_first",
    "rule_statement": "Classify a token as a noun or a verb before applying suffix or tense rules.",
    "category": "classification",
    "applies_to_part_of_speech": "noun_or_verb",
    "markers": [],
    "meaning_effect": "Prevents noun possession rules from being confused with verb subject or object rules.",
    "example_tokens": [
      "????",
      "????"
    ],
    "exception_notes": null,
    "confusion_pattern_ids": [
      "conf_noun_suffix_vs_verb_ending",
      "conf_edge_letter_heuristics"
    ],
    "progression_order": 1,
    "confidence": "inferred_strong",
    "source_refs": [
      "R3:p5",
      "R1:p1"
    ]
  },
  {
    "rule_id": "rule_noun_suffix_2ms_singular",
    "rule_statement": "A noun ending in ?/?? can mark your (one man's) object.",
    "category": "noun_suffix",
    "applies_to_part_of_speech": "noun",
    "markers": [
      "?",
      "??"
    ],
    "meaning_effect": "Adds second-person masculine singular possession to a noun.",
    "example_tokens": [
      "????"
    ],
    "exception_notes": "Only apply after confirming the token is functioning as a noun.",
    "confusion_pattern_ids": [
      "conf_noun_suffix_vs_verb_ending",
      "conf_suffix_absorbed_into_shoresh"
    ],
    "progression_order": 2,
    "confidence": "explicit",
    "source_refs": [
      "R3:p5"
    ]
  },
  {
    "rule_id": "rule_noun_suffix_2ms_plural_objects",
    "rule_statement": "A noun ending in ?? can mark your (one man's) plural objects.",
    "category": "noun_suffix",
    "applies_to_part_of_speech": "noun",
    "markers": [
      "??"
    ],
    "meaning_effect": "Adds second-person masculine singular possession to a plural noun target.",
    "example_tokens": [
      "????"
    ],
    "exception_notes": null,
    "confusion_pattern_ids": [
      "conf_suffix_absorbed_into_shoresh",
      "conf_false_plural_surface"
    ],
    "progression_order": 3,
    "confidence": "explicit",
    "source_refs": [
      "R3:p15"
    ]
  },
  {
    "rule_id": "rule_noun_suffix_2mp_family",
    "rule_statement": "Noun endings ?? and ??? mark your (many men's) singular or plural objects.",
    "category": "noun_suffix",
    "applies_to_part_of_speech": "noun",
    "markers": [
      "??",
      "???"
    ],
    "meaning_effect": "Adds second-person masculine plural possession to a noun.",
    "example_tokens": [
      "?????",
      "?????"
    ],
    "exception_notes": null,
    "confusion_pattern_ids": [
      "conf_suffix_absorbed_into_shoresh"
    ],
    "progression_order": 4,
    "confidence": "explicit",
    "source_refs": [
      "R3:p12",
      "R3:p14"
    ]
  },
  {
    "rule_id": "rule_noun_suffix_3ms_family",
    "rule_statement": "Noun endings ?/?? and ?? can mark his singular or plural objects.",
    "category": "noun_suffix",
    "applies_to_part_of_speech": "noun",
    "markers": [
      "?",
      "??",
      "??"
    ],
    "meaning_effect": "Adds third-person masculine singular possession to a noun.",
    "example_tokens": [
      "????",
      "????"
    ],
    "exception_notes": "The vav can be mistaken for a conjunction if the parser ignores word role.",
    "confusion_pattern_ids": [
      "conf_noun_suffix_vs_verb_ending",
      "conf_suffix_absorbed_into_shoresh"
    ],
    "progression_order": 5,
    "confidence": "explicit",
    "source_refs": [
      "R3:p17",
      "R3:p19"
    ]
  },
  {
    "rule_id": "rule_noun_suffix_1cs_family",
    "rule_statement": "A noun ending in ? can mark my singular object, and related variants can mark my plural objects.",
    "category": "noun_suffix",
    "applies_to_part_of_speech": "noun",
    "markers": [
      "?"
    ],
    "meaning_effect": "Adds first-person singular possession to a noun.",
    "example_tokens": [
      "????",
      "???"
    ],
    "exception_notes": "Plural-looking forms can still be singular lexical exceptions elsewhere in the curriculum.",
    "confusion_pattern_ids": [
      "conf_suffix_absorbed_into_shoresh",
      "conf_false_plural_surface"
    ],
    "progression_order": 6,
    "confidence": "explicit",
    "source_refs": [
      "R3:p36",
      "R3:p37"
    ]
  },
  {
    "rule_id": "rule_noun_suffix_1cp_family",
    "rule_statement": "Noun endings ?? and ??? mark our singular or plural objects.",
    "category": "noun_suffix",
    "applies_to_part_of_speech": "noun",
    "markers": [
      "??",
      "???"
    ],
    "meaning_effect": "Adds first-person plural possession to a noun.",
    "example_tokens": [
      "?????",
      "?????"
    ],
    "exception_notes": "Do not confuse noun possession ?? with verb subject or object suffix uses.",
    "confusion_pattern_ids": [
      "conf_noun_suffix_vs_verb_ending",
      "conf_subject_suffix_vs_object_suffix"
    ],
    "progression_order": 7,
    "confidence": "explicit",
    "source_refs": [
      "R3:p59"
    ]
  },
  {
    "rule_id": "rule_noun_suffix_3fs_family",
    "rule_statement": "Noun endings ?/?? and ?? can mark her singular or plural objects.",
    "category": "noun_suffix",
    "applies_to_part_of_speech": "noun",
    "markers": [
      "?",
      "??",
      "??"
    ],
    "meaning_effect": "Adds third-person feminine singular possession to a noun.",
    "example_tokens": [
      "????",
      "????"
    ],
    "exception_notes": null,
    "confusion_pattern_ids": [
      "conf_suffix_absorbed_into_shoresh"
    ],
    "progression_order": 8,
    "confidence": "explicit",
    "source_refs": [
      "R3:p68"
    ]
  },
  {
    "rule_id": "rule_noun_suffix_2fs_family",
    "rule_statement": "Noun endings in the feminine ??-family mark your (one lady's) singular or plural objects.",
    "category": "noun_suffix",
    "applies_to_part_of_speech": "noun",
    "markers": [
      "??",
      "???"
    ],
    "meaning_effect": "Adds second-person feminine singular possession to a noun.",
    "example_tokens": [
      "????"
    ],
    "exception_notes": "Unpointed forms can be confused with the masculine singular possessive family.",
    "confusion_pattern_ids": [
      "conf_noun_suffix_vs_verb_ending",
      "conf_suffix_absorbed_into_shoresh"
    ],
    "progression_order": 9,
    "confidence": "explicit",
    "source_refs": [
      "R3:p69"
    ]
  },
  {
    "rule_id": "rule_noun_suffix_3mp_family",
    "rule_statement": "Noun endings ? and ???/??? mark their (many men or mixed group) singular or plural objects.",
    "category": "noun_suffix",
    "applies_to_part_of_speech": "noun",
    "markers": [
      "?",
      "???"
    ],
    "meaning_effect": "Adds third-person masculine or mixed plural possession to a noun.",
    "example_tokens": [
      "????",
      "?????"
    ],
    "exception_notes": "The short ? ending can be a compressed form of a fuller plural-possessive family.",
    "confusion_pattern_ids": [
      "conf_suffix_absorbed_into_shoresh",
      "conf_false_plural_surface"
    ],
    "progression_order": 10,
    "confidence": "explicit",
    "source_refs": [
      "R3:p72"
    ]
  },
  {
    "rule_id": "rule_verb_past_2ms_suffix",
    "rule_statement": "A verb ending in ?? marks you (one man) did in the past.",
    "category": "verb_past",
    "applies_to_part_of_speech": "verb",
    "markers": [
      "??"
    ],
    "meaning_effect": "Adds second-person masculine singular subject to a past-tense verb.",
    "example_tokens": [
      "????"
    ],
    "exception_notes": "Only high-confidence after the token is classified as a verb.",
    "confusion_pattern_ids": [
      "conf_noun_suffix_vs_verb_ending"
    ],
    "progression_order": 11,
    "confidence": "explicit",
    "source_refs": [
      "R3:p7"
    ]
  },
  {
    "rule_id": "rule_verb_future_3ms_prefix",
    "rule_statement": "A prefixed ? on a verb usually marks he will.",
    "category": "verb_future",
    "applies_to_part_of_speech": "verb",
    "markers": [
      "?"
    ],
    "meaning_effect": "Adds third-person masculine singular future subject marking to a verb.",
    "example_tokens": [
      "????"
    ],
    "exception_notes": "Yod-initial roots may require nikud-sensitive handling.",
    "confusion_pattern_ids": [
      "conf_prefix_absorbed_into_shoresh",
      "conf_edge_letter_heuristics"
    ],
    "progression_order": 12,
    "confidence": "explicit",
    "source_refs": [
      "R3:p22"
    ]
  },
  {
    "rule_id": "rule_vav_future_connector",
    "rule_statement": "A prefixed ?? before a future-form verb can preserve the future reading rather than forcing a past reading.",
    "category": "vav_pattern",
    "applies_to_part_of_speech": "verb",
    "markers": [
      "??"
    ],
    "meaning_effect": "Adds conjunctional and while keeping the future reading in the curriculum's introductory vav rule family.",
    "example_tokens": [
      "??????????"
    ],
    "exception_notes": "This rule family must be separated from vav-hahipuch forms with different vocalization.",
    "confusion_pattern_ids": [
      "conf_vav_transformation_misread"
    ],
    "progression_order": 13,
    "confidence": "explicit",
    "source_refs": [
      "R3:p8"
    ]
  },
  {
    "rule_id": "rule_vav_hahipuch_past",
    "rule_statement": "A prefixed ?? on many future-shaped verbs flips the reading to past narrative sequence.",
    "category": "vav_pattern",
    "applies_to_part_of_speech": "verb",
    "markers": [
      "??",
      "??",
      "??"
    ],
    "meaning_effect": "Turns many future-shaped verbs into past narrative forms such as and he did.",
    "example_tokens": [
      "?????????"
    ],
    "exception_notes": "Guttural-initial verbs can shift the vocalization pattern.",
    "confusion_pattern_ids": [
      "conf_vav_transformation_misread",
      "conf_nikud_sensitive_distinction"
    ],
    "progression_order": 14,
    "confidence": "explicit",
    "source_refs": [
      "R3:p23",
      "R3:p24",
      "R3:p34",
      "R3:p35"
    ]
  },
  {
    "rule_id": "rule_verb_future_3mp_circumfix",